Sheet: Sheet1
A1: Elapsed time | B1: Computer | C1: Arduino | D1: Difference | E1: Diff s/h
A2: PT00H00M00S | B2: 1413855730 | C2: 1413855730 | D2: of:=[.B2]-[.C2] -> 0
A3: of:=([.B3]-[.B$2])/(60*60*24) -> PT00H05M00S | B3: 1413856030 | C3: 1413856030 | D3: of:=[.B3]-[.C3] -> 0 | E3: of:=([.D3]*24*60*60)/[.A3] -> 0
A4: of:=([.B4]-[.B$2])/(60*60*24) -> PT00H10M03S | B4: 1413856333 | C4: 1413856334 | D4: of:=[.B4]-[.C4] -> -1 | E4: of:=[.D4]/([.A4]*24) -> -5.97014925373134
A5: of:=([.B5]-[.B$2])/(60*60*24) -> PT00H15M07S | B5: 1413856637 | C5: 1413856638 | D5: of:=[.B5]-[.C5] -> -1 | E5: of:=[.D5]/([.A5]*24) -> -3.96912899669239
A6: of:=([.B6]-[.B$2])/(60*60*24) -> PT00H20M11S | B6: 1413856941 | C6: 1413856942 | D6: of:=[.B6]-[.C6] -> -1 | E6: of:=[.D6]/([.A6]*24) -> -2.97274979355904
A7: of:=([.B7]-[.B$2])/(60*60*24) -> PT00H25M15S | B7: 1413857245 | C7: 1413857246 | D7: of:=[.B7]-[.C7] -> -1 | E7: of:=[.D7]/([.A7]*24) -> -2.37623762376238
A8: of:=([.B8]-[.B$2])/(60*60*24) -> PT00H30M19S | B8: 1413857549 | C8: 1413857550 | D8: of:=[.B8]-[.C8] -> -1 | E8: of:=[.D8]/([.A8]*24) -> -1.97910940076965
A9: of:=([.B9]-[.B$2])/(60*60*24) -> PT00H35M22S | B9: 1413857852 | C9: 1413857854 | D9: of:=[.B9]-[.C9] -> -2 | E9: of:=[.D9]/([.A9]*24) -> -3.39302544769086
A10: of:=([.B10]-[.B$2])/(60*60*24) -> PT00H40M26S | B10: 1413858156 | C10: 1413858158 | D10: of:=[.B10]-[.C10] -> -2 | E10: of:=[.D10]/([.A10]*24) -> -2.96784830997527
A11: of:=([.B11]-[.B$2])/(60*60*24) -> PT00H45M30S | B11: 1413858460 | C11: 1413858462 | D11: of:=[.B11]-[.C11] -> -2 | E11: of:=[.D11]/([.A11]*24) -> -2.63736263736264
A12: of:=([.B12]-[.B$2])/(60*60*24) -> PT00H50M34S | B12: 1413858764 | C12: 1413858766 | D12: of:=[.B12]-[.C12] -> -2 | E12: of:=[.D12]/([.A12]*24) -> -2.3731048121292
A13: of:=([.B13]-[.B$2])/(60*60*24) -> PT00H55M38S | B13: 1413859068 | C13: 1413859070 | D13: of:=[.B13]-[.C13] -> -2 | E13: of:=[.D13]/([.A13]*24) -> -2.15698022768125
A14: of:=([.B14]-[.B$2])/(60*60*24) -> PT01H00M41S | B14: 1413859371 | C14: 1413859374 | D14: of:=[.B14]-[.C14] -> -3 | E14: of:=[.D14]/([.A14]*24) -> -2.96621807195825
A15: of:=([.B15]-[.B$2])/(60*60*24) -> PT01H05M45S | B15: 1413859675 | C15: 1413859678 | D15: of:=[.B15]-[.C15] -> -3 | E15: of:=[.D15]/([.A15]*24) -> -2.73764258555133
A16: of:=([.B16]-[.B$2])/(60*60*24) -> PT01H10M49S | B16: 1413859979 | C16: 1413859982 | D16: of:=[.B16]-[.C16] -> -3 | E16: of:=[.D16]/([.A16]*24) -> -2.54177453518475
A17: of:=([.B17]-[.B$2])/(60*60*24) -> PT01H15M53S | B17: 1413860283 | C17: 1413860286 | D17: of:=[.B17]-[.C17] -> -3 | E17: of:=[.D17]/([.A17]*24) -> -2.37206237645508
A18: of:=([.B18]-[.B$2])/(60*60*24) -> PT01H20M57S | B18: 1413860587 | C18: 1413860590 | D18: of:=[.B18]-[.C18] -> -3 | E18: of:=[.D18]/([.A18]*24) -> -2.22359481161211
A19: of:=([.B19]-[.B$2])/(60*60*24) -> PT01H26M01S | B19: 1413860891 | C19: 1413860894 | D19: of:=[.B19]-[.C19] -> -3 | E19: of:=[.D19]/([.A19]*24) -> -2.09261770974617
A20: of:=([.B20]-[.B$2])/(60*60*24) -> PT01H31M04S | B20: 1413861194 | C20: 1413861198 | D20: of:=[.B20]-[.C20] -> -4 | E20: of:=[.D20]/([.A20]*24) -> -2.63543191800878
A21: of:=([.B21]-[.B$2])/(60*60*24) -> PT01H36M08S | B21: 1413861498 | C21: 1413861502 | D21: of:=[.B21]-[.C21] -> -4 | E21: of:=[.D21]/([.A21]*24) -> -2.49653259361997
A22: of:=([.B22]-[.B$2])/(60*60*24) -> PT01H41M12S | B22: 1413861802 | C22: 1413861806 | D22: of:=[.B22]-[.C22] -> -4 | E22: of:=[.D22]/([.A22]*24) -> -2.37154150197628
A23: of:=([.B23]-[.B$2])/(60*60*24) -> PT01H46M16S | B23: 1413862106 | C23: 1413862110 | D23: of:=[.B23]-[.C23] -> -4 | E23: of:=[.D23]/([.A23]*24) -> -2.25846925972397
A24: of:=([.B24]-[.B$2])/(60*60*24) -> PT01H51M20S | B24: 1413862410 | C24: 1413862414 | D24: of:=[.B24]-[.C24] -> -4 | E24: of:=[.D24]/([.A24]*24) -> -2.15568862275449
A25: of:=([.B25]-[.B$2])/(60*60*24) -> PT01H56M23S | B25: 1413862713 | C25: 1413862718 | D25: of:=[.B25]-[.C25] -> -5 | E25: of:=[.D25]/([.A25]*24) -> -2.57768867249033
A26: of:=([.B26]-[.B$2])/(60*60*24) -> PT02H01M27S | B26: 1413863017 | C26: 1413863022 | D26: of:=[.B26]-[.C26] -> -5 | E26: of:=[.D26]/([.A26]*24) -> -2.47015232606011
A27: of:=([.B27]-[.B$2])/(60*60*24) -> PT02H06M31S | B27: 1413863321 | C27: 1413863326 | D27: of:=[.B27]-[.C27] -> -5 | E27: of:=[.D27]/([.A27]*24) -> -2.3712290870768
A28: of:=([.B28]-[.B$2])/(60*60*24) -> PT02H11M35S | B28: 1413863625 | C28: 1413863630 | D28: of:=[.B28]-[.C28] -> -5 | E28: of:=[.D28]/([.A28]*24) -> -2.27992400253325
A29: of:=([.B29]-[.B$2])/(60*60*24) -> PT02H16M39S | B29: 1413863929 | C29: 1413863934 | D29: of:=[.B29]-[.C29] -> -5 | E29: of:=[.D29]/([.A29]*24) -> -2.1953896816685
A30: of:=([.B30]-[.B$2])/(60*60*24) -> PT02H21M42S | B30: 1413864232 | C30: 1413864238 | D30: of:=[.B30]-[.C30] -> -6 | E30: of:=[.D30]/([.A30]*24) -> -2.54057868736768
A31: of:=([.B31]-[.B$2])/(60*60*24) -> PT02H26M46S | B31: 1413864536 | C31: 1413864542 | D31: of:=[.B31]-[.C31] -> -6 | E31: of:=[.D31]/([.A31]*24) -> -2.45287304110834
A32: of:=([.B32]-[.B$2])/(60*60*24) -> PT02H31M50S | B32: 1413864840 | C32: 1413864846 | D32: of:=[.B32]-[.C32] -> -6 | E32: of:=[.D32]/([.A32]*24) -> -2.37102085620198
A33: of:=([.B33]-[.B$2])/(60*60*24) -> PT02H36M54S | B33: 1413865144 | C33: 1413865150 | D33: of:=[.B33]-[.C33] -> -6 | E33: of:=[.D33]/([.A33]*24) -> -2.29445506692161
A34: of:=([.B34]-[.B$2])/(60*60*24) -> PT02H41M58S | B34: 1413865448 | C34: 1413865454 | D34: of:=[.B34]-[.C34] -> -6 | E34: of:=[.D34]/([.A34]*24) -> -2.22267956369623
A35: of:=([.B35]-[.B$2])/(60*60*24) -> PT02H47M01S | B35: 1413865751 | C35: 1413865758 | D35: of:=[.B35]-[.C35] -> -7 | E35: of:=[.D35]/([.A35]*24) -> -2.51471908991119
A36: of:=([.B36]-[.B$2])/(60*60*24) -> PT02H52M05S | B36: 1413866055 | C36: 1413866062 | D36: of:=[.B36]-[.C36] -> -7 | E36: of:=[.D36]/([.A36]*24) -> -2.44067796610169
A37: of:=([.B37]-[.B$2])/(60*60*24) -> PT02H57M09S | B37: 1413866359 | C37: 1413866366 | D37: of:=[.B37]-[.C37] -> -7 | E37: of:=[.D37]/([.A37]*24) -> -2.37087214225233
A38: of:=([.B38]-[.B$2])/(60*60*24) -> PT03H02M13S | B38: 1413866663 | C38: 1413866670 | D38: of:=[.B38]-[.C38] -> -7 | E38: of:=[.D38]/([.A38]*24) -> -2.30494832159517
A39: of:=([.B39]-[.B$2])/(60*60*24) -> PT03H07M17S | B39: 1413866967 | C39: 1413866974 | D39: of:=[.B39]-[.C39] -> -7 | E39: of:=[.D39]/([.A39]*24) -> -2.24259143899617
A40: of:=([.B40]-[.B$2])/(60*60*24) -> PT03H12M21S | B40: 1413867271 | C40: 1413867278 | D40: of:=[.B40]-[.C40] -> -7 | E40: of:=[.D40]/([.A40]*24) -> -2.18351962568235
A41: of:=([.B41]-[.B$2])/(60*60*24) -> PT03H17M24S | B41: 1413867574 | C41: 1413867582 | D41: of:=[.B41]-[.C41] -> -8 | E41: of:=[.D41]/([.A41]*24) -> -2.43161094224924
A42: of:=([.B42]-[.B$2])/(60*60*24) -> PT03H22M28S | B42: 1413867878 | C42: 1413867886 | D42: of:=[.B42]-[.C42] -> -8 | E42: of:=[.D42]/([.A42]*24) -> -2.37076061903194
A43: of:=([.B43]-[.B$2])/(60*60*24) -> PT03H27M32S | B43: 1413868182 | C43: 1413868190 | D43: of:=[.B43]-[.C43] -> -8 | E43: of:=[.D43]/([.A43]*24) -> -2.31288146482493
A44: of:=([.B44]-[.B$2])/(60*60*24) -> PT03H32M36S | B44: 1413868486 | C44: 1413868494 | D44: of:=[.B44]-[.C44] -> -8 | E44: of:=[.D44]/([.A44]*24) -> -2.25776105362182
A45: of:=([.B45]-[.B$2])/(60*60*24) -> PT03H37M40S | B45: 1413868790 | C45: 1413868798 | D45: of:=[.B45]-[.C45] -> -8 | E45: of:=[.D45]/([.A45]*24) -> -2.2052067381317
A46: of:=([.B46]-[.B$2])/(60*60*24) -> PT03H42M43S | B46: 1413869093 | C46: 1413869102 | D46: of:=[.B46]-[.C46] -> -9 | E46: of:=[.D46]/([.A46]*24) -> -2.42460525331138
A47: of:=([.B47]-[.B$2])/(60*60*24) -> PT03H47M47S | B47: 1413869397 | C47: 1413869406 | D47: of:=[.B47]-[.C47] -> -9 | E47: of:=[.D47]/([.A47]*24) -> -2.37067388600278
A48: of:=([.B48]-[.B$2])/(60*60*24) -> PT03H52M51S | B48: 1413869701 | C48: 1413869710 | D48: of:=[.B48]-[.C48] -> -9 | E48: of:=[.D48]/([.A48]*24) -> -2.31908954262401
A49: of:=([.B49]-[.B$2])/(60*60*24) -> PT03H57M55S | B49: 1413870005 | C49: 1413870014 | D49: of:=[.B49]-[.C49] -> -9 | E49: of:=[.D49]/([.A49]*24) -> -2.26970227670753
A50: of:=([.B50]-[.B$2])/(60*60*24) -> PT04H02M59S | B50: 1413870309 | C50: 1413870318 | D50: of:=[.B50]-[.C50] -> -9 | E50: of:=[.D50]/([.A50]*24) -> -2.22237464846697
A51: of:=([.B51]-[.B$2])/(60*60*24) -> PT04H08M02S | B51: 1413870612 | C51: 1413870622 | D51: of:=[.B51]-[.C51] -> -10 | E51: of:=[.D51]/([.A51]*24) -> -2.4190297003091
A52: of:=([.B52]-[.B$2])/(60*60*24) -> PT04H13M06S | B52: 1413870916 | C52: 1413870926 | D52: of:=[.B52]-[.C52] -> -10 | E52: of:=[.D52]/([.A52]*24) -> -2.37060450414856
A53: of:=([.B53]-[.B$2])/(60*60*24) -> PT04H18M10S | B53: 1413871220 | C53: 1413871230 | D53: of:=[.B53]-[.C53] -> -10 | E53: of:=[.D53]/([.A53]*24) -> -2.32408005164622
A54: of:=([.B54]-[.B$2])/(60*60*24) -> PT04H23M14S | B54: 1413871524 | C54: 1413871534 | D54: of:=[.B54]-[.C54] -> -10 | E54: of:=[.D54]/([.A54]*24) -> -2.27934658731164
A55: of:=([.B55]-[.B$2])/(60*60*24) -> PT04H28M18S | B55: 1413871828 | C55: 1413871838 | D55: of:=[.B55]-[.C55] -> -10 | E55: of:=[.D55]/([.A55]*24) -> -2.23630264629146
A56: of:=([.B56]-[.B$2])/(60*60*24) -> PT04H33M21S | B56: 1413872131 | C56: 1413872142 | D56: of:=[.B56]-[.C56] -> -11 | E56: of:=[.D56]/([.A56]*24) -> -2.41448692152918
A57: of:=([.B57]-[.B$2])/(60*60*24) -> PT04H38M25S | B57: 1413872435 | C57: 1413872446 | D57: of:=[.B57]-[.C57] -> -11 | E57: of:=[.D57]/([.A57]*24) -> -2.37054774019755
A58: of:=([.B58]-[.B$2])/(60*60*24) -> PT04H43M29S | B58: 1413872739 | C58: 1413872750 | D58: of:=[.B58]-[.C58] -> -11 | E58: of:=[.D58]/([.A58]*24) -> -2.32817919924746
A59: of:=([.B59]-[.B$2])/(60*60*24) -> PT04H48M33S | B59: 1413873043 | C59: 1413873054 | D59: of:=[.B59]-[.C59] -> -11 | E59: of:=[.D59]/([.A59]*24) -> -2.28729856177439
A60: of:=([.B60]-[.B$2])/(60*60*24) -> PT04H53M37S | B60: 1413873347 | C60: 1413873358 | D60: of:=[.B60]-[.C60] -> -11 | E60: of:=[.D60]/([.A60]*24) -> -2.24782880172561
A61: of:=([.B61]-[.B$2])/(60*60*24) -> PT04H58M41S | B61: 1413873651 | C61: 1413873662 | D61: of:=[.B61]-[.C61] -> -11 | E61: of:=[.D61]/([.A61]*24) -> -2.20969811952458
A62: of:=([.B62]-[.B$2])/(60*60*24) -> PT05H03M44S | B62: 1413873954 | C62: 1413873966 | D62: of:=[.B62]-[.C62] -> -12 | E62: of:=[.D62]/([.A62]*24) -> -2.37050043898156
A63: of:=([.B63]-[.B$2])/(60*60*24) -> PT05H08M48S | B63: 1413874258 | C63: 1413874270 | D63: of:=[.B63]-[.C63] -> -12 | E63: of:=[.D63]/([.A63]*24) -> -2.33160621761658
A64: of:=([.B64]-[.B$2])/(60*60*24) -> PT05H13M52S | B64: 1413874562 | C64: 1413874574 | D64: of:=[.B64]-[.C64] -> -12 | E64: of:=[.D64]/([.A64]*24) -> -2.29396771452846
A65: of:=([.B65]-[.B$2])/(60*60*24) -> PT05H18M56S | B65: 1413874866 | C65: 1413874878 | D65: of:=[.B65]-[.C65] -> -12 | E65: of:=[.D65]/([.A65]*24) -> -2.25752508361204
A66: of:=([.B66]-[.B$2])/(60*60*24) -> PT05H24M00S | B66: 1413875170 | C66: 1413875182 | D66: of:=[.B66]-[.C66] -> -12 | E66: of:=[.D66]/([.A66]*24) -> -2.22222222222222
A67: of:=([.B67]-[.B$2])/(60*60*24) -> PT05H29M03S | B67: 1413875473 | C67: 1413875486 | D67: of:=[.B67]-[.C67] -> -13 | E67: of:=[.D67]/([.A67]*24) -> -2.3704604163501
A68: of:=([.B68]-[.B$2])/(60*60*24) -> PT05H34M07S | B68: 1413875777 | C68: 1413875790 | D68: of:=[.B68]-[.C68] -> -13 | E68: of:=[.D68]/([.A68]*24) -> -2.33451389235297
A69: of:=([.B69]-[.B$2])/(60*60*24) -> PT05H39M11S | B69: 1413876081 | C69: 1413876094 | D69: of:=[.B69]-[.C69] -> -13 | E69: of:=[.D69]/([.A69]*24) -> -2.29964129526805
A70: of:=([.B70]-[.B$2])/(60*60*24) -> PT05H44M15S | B70: 1413876385 | C70: 1413876398 | D70: of:=[.B70]-[.C70] -> -13 | E70: of:=[.D70]/([.A70]*24) -> -2.26579520697168
A71: of:=([.B71]-[.B$2])/(60*60*24) -> PT05H49M19S | B71: 1413876689 | C71: 1413876702 | D71: of:=[.B71]-[.C71] -> -13 | E71: of:=[.D71]/([.A71]*24) -> -2.23293096044659
A72: of:=([.B72]-[.B$2])/(60*60*24) -> PT05H54M22S | B72: 1413876992 | C72: 1413877006 | D72: of:=[.B72]-[.C72] -> -14 | E72: of:=[.D72]/([.A72]*24) -> -2.37042611231305
A73: of:=([.B73]-[.B$2])/(60*60*24) -> PT05H59M26S | B73: 1413877296 | C73: 1413877310 | D73: of:=[.B73]-[.C73] -> -14 | E73: of:=[.D73]/([.A73]*24) -> -2.33701196327553
A74: of:=([.B74]-[.B$2])/(60*60*24) -> PT06H04M30S | B74: 1413877600 | C74: 1413877614 | D74: of:=[.B74]-[.C74] -> -14 | E74: of:=[.D74]/([.A74]*24) -> -2.30452674897119
A75: of:=([.B75]-[.B$2])/(60*60*24) -> PT06H09M34S | B75: 1413877904 | C75: 1413877918 | D75: of:=[.B75]-[.C75] -> -14 | E75: of:=[.D75]/([.A75]*24) -> -2.27293226301073
A76: of:=([.B76]-[.B$2])/(60*60*24) -> PT06H14M38S | B76: 1413878208 | C76: 1413878222 | D76: of:=[.B76]-[.C76] -> -14 | E76: of:=[.D76]/([.A76]*24) -> -2.24219236586885